[
  {
    "id": "science_muscular_endurance_adaptation",
    "slug": "muscular-endurance-adaptation",
    "displayName": "Muscular endurance",
    "aliases": [],
    "abbreviations": [],
    "category": "adaptations-goals",
    "contentType": "adaptation",
    "goalTags": [
      "general-fitness"
    ],
    "experienceTags": [
      "foundation"
    ],
    "contentStatus": "published",
    "learningOrder": 12,
    "version": "1.0.0",
    "updatedAt": "2026-10-08",
    "definition": "This page covers the overview’s muscular-endurance outcome, without assuming that strength findings apply identically.",
    "summary": "The overview reports improved muscular endurance with resistance training compared with no exercise; its reviewed analyses included standard and home-based training.",
    "whyItMatters": "Keep the outcome explicit; the overview does not establish one optimal endurance prescription.",
    "keyTakeaways": [
      "The overview reports improved muscular endurance with resistance training compared with no exercise; its reviewed analyses included standard and home-based training.",
      "There were insufficient data to determine muscular-endurance effects of load, power training, volume or set structure in the reviewed comparisons.",
      "Keep the outcome explicit; the overview does not establish one optimal endurance prescription."
    ],
    "goalContexts": [
      {
        "goal": "general-fitness",
        "interpretation": "The overview reports improved muscular endurance with resistance training compared with no exercise; its reviewed analyses included standard and home-based training.",
        "qualifiers": [
          "Eligible healthy adults aged at least 18 with no defined disease, in resistance-training studies lasting at least six weeks; group results are not individual predictions or clinical/youth guidance.",
          "Most included reviews concerned participants with minimal or no resistance-training experience; some included advanced trainees.",
          "The overview searched reviews through October 2024. Only the identified eligibility and adaptation sections support this extraction.",
          "No independent human, clinical or new GRADE appraisal; overlapping reviews, differing protocols and insufficient variable-specific evidence constrain interpretation."
        ],
        "sourceIds": [
          "source_acsm_rt_2026_adaptations"
        ]
      }
    ],
    "decisionFramework": {
      "solves": [
        "Keep the outcome explicit; the overview does not establish one optimal endurance prescription."
      ],
      "prioritizeWhen": [
        "The outcome and healthy-adult scope match the question."
      ],
      "deprioritizeWhen": [
        "The proposed application exceeds the inspected evidence."
      ],
      "adjustmentLevers": [
        "Use the source framework with explicit limits; no automatic personal prescription."
      ],
      "watchFor": [
        "Studied outcome, eligible population, training experience and insufficient comparison evidence."
      ],
      "cannotTellYou": [
        "Your exact response, optimal plan, recovery status or clinical suitability."
      ]
    },
    "claims": [
      {
        "id": "claim_science_muscular_endurance_adaptation_acsm_adaptation_1",
        "claimText": "The overview reports improved muscular endurance with resistance training compared with no exercise; its reviewed analyses included standard and home-based training.",
        "claimType": "comparative-effect",
        "outcome": "muscular-endurance",
        "population": [
          "healthy-adults"
        ],
        "evidenceLevel": "consensus-practice",
        "confidence": "limited",
        "direction": "benefit",
        "effectQualifier": "Source-position-stand summary with limited editorial confidence; not a new formal GRADE assessment or individual response estimate.",
        "sourceIds": [
          "source_acsm_rt_2026_adaptations"
        ],
        "limitations": [
          "Eligible healthy adults aged at least 18 with no defined disease, in resistance-training studies lasting at least six weeks; group results are not individual predictions or clinical/youth guidance.",
          "Most included reviews concerned participants with minimal or no resistance-training experience; some included advanced trainees.",
          "The overview searched reviews through October 2024. Only the identified eligibility and adaptation sections support this extraction.",
          "No independent human, clinical or new GRADE appraisal; overlapping reviews, differing protocols and insufficient variable-specific evidence constrain interpretation."
        ],
        "lastVerified": "2026-10-08"
      },
      {
        "id": "claim_science_muscular_endurance_adaptation_acsm_adaptation_2",
        "claimText": "There were insufficient data to determine muscular-endurance effects of load, power training, volume or set structure in the reviewed comparisons.",
        "claimType": "null-or-inconsistent",
        "outcome": "muscular-endurance",
        "population": [
          "healthy-adults"
        ],
        "evidenceLevel": "consensus-practice",
        "confidence": "limited",
        "direction": "context-dependent",
        "effectQualifier": "Source-position-stand summary with limited editorial confidence; not a new formal GRADE assessment or individual response estimate.",
        "sourceIds": [
          "source_acsm_rt_2026_adaptations"
        ],
        "limitations": [
          "Eligible healthy adults aged at least 18 with no defined disease, in resistance-training studies lasting at least six weeks; group results are not individual predictions or clinical/youth guidance.",
          "Most included reviews concerned participants with minimal or no resistance-training experience; some included advanced trainees.",
          "The overview searched reviews through October 2024. Only the identified eligibility and adaptation sections support this extraction.",
          "No independent human, clinical or new GRADE appraisal; overlapping reviews, differing protocols and insufficient variable-specific evidence constrain interpretation."
        ],
        "lastVerified": "2026-10-08"
      }
    ],
    "practicalGuidance": [
      {
        "context": "Interpreting a reviewed adaptation outcome",
        "guidanceText": "Keep the outcome explicit; the overview does not establish one optimal endurance prescription.",
        "numericValue": null,
        "qualifiers": [
          "Eligible healthy adults aged at least 18 with no defined disease, in resistance-training studies lasting at least six weeks; group results are not individual predictions or clinical/youth guidance.",
          "Most included reviews concerned participants with minimal or no resistance-training experience; some included advanced trainees.",
          "The overview searched reviews through October 2024. Only the identified eligibility and adaptation sections support this extraction.",
          "No independent human, clinical or new GRADE appraisal; overlapping reviews, differing protocols and insufficient variable-specific evidence constrain interpretation."
        ],
        "sourceIds": [
          "source_acsm_rt_2026_adaptations"
        ]
      }
    ],
    "limitations": [
      "Eligible healthy adults aged at least 18 with no defined disease, in resistance-training studies lasting at least six weeks; group results are not individual predictions or clinical/youth guidance.",
      "Most included reviews concerned participants with minimal or no resistance-training experience; some included advanced trainees.",
      "The overview searched reviews through October 2024. Only the identified eligibility and adaptation sections support this extraction.",
      "No independent human, clinical or new GRADE appraisal; overlapping reviews, differing protocols and insufficient variable-specific evidence constrain interpretation.",
      "Insufficient data do not establish equivalence or prove absence of an effect; no magnitude or individual protocol is supplied here."
    ],
    "prerequisiteTopicIds": [],
    "relatedTopicIds": [
      "science_specificity",
      "science_power_adaptation",
      "science_strength_adaptation"
    ],
    "commonlyConfusedTopicIds": [],
    "comparedTopicIds": [],
    "relatedExerciseIds": [],
    "relatedMuscleIds": [],
    "futureProgramIds": [],
    "sources": [
      {
        "id": "source_acsm_rt_2026_adaptations",
        "title": "American College of Sports Medicine Position Stand. Resistance Training Prescription for Muscle Function, Hypertrophy, and Physical Performance in Healthy Adults: An Overview of Reviews",
        "authorsOrOrganization": "Currier and colleagues; American College of Sports Medicine",
        "sourceType": "position-stand",
        "year": 2026,
        "doi": "10.1249/MSS.0000000000003897",
        "pmid": "41843416",
        "url": "https://europepmc.org/articles/PMC12965823",
        "accessedAt": "2026-10-08",
        "notes": "Source article states CC BY-NC-ND 4.0. Only brief original factual observations and linked attribution are retained; no source table, figure, paragraph or adapted reproduction of the work is published. No permission to adapt the full work or use it commercially is asserted. Selected Eligibility, Power and Muscular Endurance passages inspected from the retained primary Europe PMC XML."
      }
    ],
    "review": {
      "subjectReviewerRole": "Machine source extraction; no independent subject reviewer",
      "editorialReviewerRole": "Codex machine editorial validation; personal use",
      "reviewedAt": "2026-10-08",
      "nextReviewDue": "2027-10-08",
      "claimReviewComplete": true,